{"schema":"proposal/v1","task":"T9","outcome":"done","summary":"The index Agreement column, the v2 guides and the domain edits were already in place and the gate passes; this attempt fixes the go check that failed after them.","files":["internal/cli/intervention_test.go"],"verified":"vloop task gate T9 exited 0 and printed ok; go test ./internal/cli passes with VLOOP_* unset.","notes":"The previous attempt failed the go check only because TestExistingInterventionsValidate validated every record against intervention/v1, and this repo's records are now v2. It now validates each against the schema named in the record. This edits an existing test, which a v2 repo needs. Inside a session the VLOOP_* env makes TestTaskGate* fail; unset it to run go test."}
