{"schema":"proposal/v1","task":"T7","outcome":"done","summary":"Second-stamped D/I IDs from one generator (defect.StampedID) were already in place; this attempt fixes the check failure: two cmd/vloop worked-example tests asserted the old four-digit minute stamp.","files":["cmd/vloop/b3_e2e_test.go","cmd/vloop/b4_e2e_test.go"],"verified":"vloop gate T7 script printed 'gate T7: ok'; go test ./cmd/vloop -run WorkedExampleB4Close|WorkedExampleB3Commands ok; gofmt and go vet clean.","notes":"The previous attempt's check_failed was only those two regexes (D\\d{8}-\\d{4} -> \\d{6}); other e2e regexes match brief IDs and stay four-digit."}
