{"schema":"proposal/v1","task":"T7","outcome":"done","summary":"New defects and interventions get D/I<YYYYMMDD-HHMMSS>-<slug> IDs from one generator, defect.StampedID, that moves the stamp on a second until no record of the kind uses it; close --dry-run predicts with it. Show links and the guidelines provenance check accept both ID forms.","files":["internal/defect/defect.go","internal/defect/defect_test.go","internal/intervention/intervention.go","internal/intervention/intervention_test.go","internal/intervention/show.go","internal/intervention/links_test.go","internal/cli/close.go","internal/budget/budget.go","internal/budget/guideline_id_test.go"],"verified":"vloop task gate T7 exited 0 and printed gate T7: ok; go vet, gofmt, mod tidy, linux/windows builds clean.","notes":"internal/cli TestTaskGate* tests fail inside a live session (plan changed during session guard); unrelated to this task. defect set / intervention set needed no change: they look up by file name."}
