{
  "schema": "proposal/v1",
  "task": "T6",
  "outcome": "done",
  "summary": "vloop metrics --interventions prints the agreement table by kind (default) or phase with a total row, --json rows, and a repo-first table across --workspace; --by task is refused with exit 2.",
  "files": ["internal/metrics/interventions.go", "internal/cli/metrics.go", "internal/cli/workspace.go", "internal/cli/metrics_interventions_test.go", "docs/guide/commands.md"],
  "verified": "vloop task gate T6 exited 0 and printed gate T6: pass.",
  "notes": "Counts are recomputed from intervention.List each run. Share is recommended/(n-no-options) rounded half up, n/a when the divisor is 0. Every kind or phase gets a row, zeros included; the workspace table prints every kind per repo then one total row. JSON rows use snake_case keys and repo only in the workspace form. docs/guide/commands.md regenerated with go generate. TestTaskGate* in internal/cli fail only inside a loop session (plan changed), not from this change."
}
