{"schema":"proposal/v1","task":"T9","outcome":"done","summary":"Deleted the tracked file named --help at the repository root; the rest (copyReport warning, restore failures reported, plan Sync before rename, gendocs refusing leading-dash args, CLAUDE.md section text) was done in the earlier attempt and is in HEAD.","files":["--help"],"verified":"vloop task gate T9 exited 0 and printed gate T9: ok.","notes":"The deletion used git rm, so it is staged as well as removed from the working tree."}
