{
  "schema": "proposal/v1",
  "task": "T17",
  "outcome": "done",
  "summary": "domain-model.md carries S-2, S-4, R-3 and R-4 as the brief quotes them; session.md, run.md, task.md, brief.md and the concepts.md exit-code table describe the B8 behaviour.",
  "files": ["docs/domain/domain-model.md", "docs/domain/execution/session.md", "docs/domain/execution/run.md", "docs/domain/execution/task.md", "docs/domain/briefing/brief.md", "docs/guide/concepts.md"],
  "verified": "vloop task gate T17 exited 0 and printed GATE OK.",
  "notes": "No new edits this attempt: the doc changes were committed with the earlier block; the operator then replaced the gate so the brief check skips the running brief, and this attempt only re-ran it. In domain-model.md S-4 sits before S-3 in the list, as it was written."
}
