{"schema":"proposal/v1","task":"T2","outcome":"done","summary":"install.Stamp carries an optional module right after commit, set by init and upgrade from the binary's module version and dropped when it has none; install/v1 takes module as an optional string. Added the schema test the previous review found missing.","files":["internal/install/install.go","internal/cli/init.go","internal/cli/upgrade.go","schemas/install.v1.json","internal/cli/upgrade_test.go","internal/schema/schema_test.go"],"verified":"vloop task gate T2 exited 0 and printed ok; go test ./internal/schema passes.","notes":"I1: TestStampModule (init/upgrade with and without module) and the new TestInstallModuleIsOptionalString in internal/schema; no earlier test needed changing. TestTaskGate* in internal/cli fail only inside a loop session (plan-changed guard)."}
