{"schema":"proposal/v1","task":"T4","outcome":"done","summary":"Added run/agent/model/effort.second-review keys, doctor's second-review row and no-independence warning, the reworded copilot experimental warning for both reviewers, and run preflight refusals (default model, login, K1 skill clash) for a copilot second reviewer in use.","files":["internal/config/config.go","internal/config/config_test.go","internal/cli/doctor.go","internal/cli/run.go","internal/cli/doctor_copilot_test.go","internal/cli/doctor_second_review_test.go","internal/cli/config_test.go","docs/guide/configuration.md"],"verified":"vloop task gate T4 exited 0 and printed gate T4: ok; go test ./internal/cli ./internal/config passed.","notes":"Doctor rows for the second review are named 'run.second-review:' (with colon) so the printed line matches the brief's text. Copilot checks (on PATH, version, login, skill clashes) run once when either reviewer is copilot; the experimental warning is per key. Only the key table rows and the Copilot paragraph's first sentence of configuration.md were touched (tests require every key documented); T7 owns the rest. Existing tests changed: config list/JSON/defaults tests (new keys) and copilotWarning const (reworded warning, T4 contract). Under go test ./..., unset VLOOP_PLAN_SHA256."}
